<?xml version="1.0" encoding="UTF-8"?>
<!DOCTYPE trofeosYGanadores SYSTEM "SimulacroExamen.dtd">

<trofeosYGanadores>
	<ganadores nombre = "Di Stéfano" añoNacimiento = "1960" equipo = "Real Madrid" codigo = "a" estado = "retirado"/>
	<ganadores nombre = "Koeman" añoNacimiento = "1961" equipo = "Barcelona" codigo = "b" estado = "retirado"/>
	<ganadores nombre = "Pelé" añoNacimiento = "1962" equipo = "Juventus" codigo = "c" estado = "retirado"/>
	<trofeos>
		<balondeoro codigosRef ="a b">Di Stéfano lo ganó 3 veces</balondeoro>
		<champions codigosRef = "a c">Se juega en Wemble</champions>
		<copa codigoRef = "c">Se jugó en el Santiago Bernabéu &copa;</copa>
		<supercopa codigosRef = "a c"><jugada estadio ="Camp Nou"/></supercopa>
		<supercopa codigosRef = "b"/>
		<supercopa codigosRef = "c">El equipo de Pelé la gano en el 1962</supercopa>
	</trofeos>
</trofeosYGanadores>